Id,message,recall
41,"This person has a lot of friends. He likes to make plans with them, but doesn't always follow through on those plans. He is into adventure. He has climbed Mt. McKinley, kayaked down rapids, gone mountain biking at night and done back country skiing. He likes to read books and will correct any grammatical errors he hears. He's a great speaker on many topics.","Michael likes to do adventurous things. He has climbed Mt. McKinley, shot the rapids in a kayak in Colorado, gone downhill mountain biking at night and done backcountry skiing without avalanche safety training. He reads a lot and is a good speaker on many topics. He will correct your grammar if you are talking with him. He has many acquaintances and talks hurriedly with them. He makes plans to do things quickly but doesn't always follow through on the plans."
42,Michael likes to have conversations and he completes all assignments on time no matter how long it takes for him to do it he loves Adventure.,He did not like Michael Michael was adventurous
43,"I read the description of a man who likes adventure. He has climbed Mt McKinley, gone skydiving, gone on the Colorado Rapids, and other exciting things. He also likes reading a lot.","The passage I read was a description of a man named Michael. He was very adventurous and had done things like climb Mt McKinley, go skydiving, and go on the Colorado Rapids. He was also into reading."
44,"this person is a bit of a dare devil, he has climbed mountains, gone skiing. he says what is on his mind, he makes friends easily but doesnt always follow through with his plans with friends. When he sets his mind to do something he does it.","micheal is a dare devil, he likes skiing, climbing moutains. he tends to speak his mind, he makes friends easily, he is determined. once he sets his mind to something he does it."
45,They are an accomplished mountain climber and backwoods skier. They are an excellent conversationilist but they have a tendency to correct other people's grammar. They are superficial and have a tendency to make plans with others that they don't keep.,His name was Michael and he gave blunt feedback to his friend about her painting that it needed more work. He was an experienced mount climber who had climbed Mt. McKinley. He was also an avid backwoods skier. He was a good conversationalist and someone who reads lots of books. He was known to correct people on their grammar during conversations. He was a superficial person who tended to make plans with others that he wouldn't keep.
46,this person takes a lot of risks. does not practice safety. they have done many adventurous things like mountain climbing and kayaking. they probably brag about this a lot. they have many acquaintances but not many friends. they frequently correct others grammar and probably think they are always right.,climbed mount McKinley. corrects other people's grammar. has lots of acquaintances but talks to them in a very hurried manner. hasn't had any avalanche training. has done a lot of adventurous things like hiking and kayaking
47,this person likes to skiing he also like kayaking he is a great conversationalist and can talk at length about all kinds of topics,he likes to kayak he also like to coversate
48,"This person always speaks his mind. He was once asked to comment on someone's painting and he suggested they should do more work. He is very adventuresome, often taking risks. His feats include kayaking on rapids and skiing in a dangerous environment without avalanche training just to name a couple. He is knowledgeable on many subjects and will often correct others' grammatical mistakes he overhears. Once he decides on doing something, he pursues it until accomplished.","The person described was very outgoing. He spoke his mind at all times. He once criticized someone's art because he was asked his opinion; he suggested it needed more work. This person had knowledge on many subjects and was very good with verbal skills socially. He would sometimes correct grammatical mistakes others made in casual conversation. He loved adventure which included skiing, kayaking down rapids, and climbing mountains. He took many risks in pursuing these activities."
49,He is an avid outdoorsman and has climbed Mt. McKinley and gone mountain biking at night. He is a good conversationalist and has many friends.,He hiked Mt Mckinley and went mountain bike riding at night. He was a good conversationalist and had lots of friends.
50,"This person is often quite blunt and very pedantic at times, worrying about the little things. He tends to be a bit aloof a lot, making many short hand associates/acquaintances, but has problems keeping up with them when making plans. He also is quite the conversationalist and is a decent speaker. He is very adventurous, tends to take lots of risks even when he doesn't want to, some might even call him stubborn.","The person was adventurous and a big risk taker, sometimes endangering their life or health. They were a good conversationalist and speaker and could make acquaintances quickly, but had problems following up on plans. They're pretty blunt and say whatever is on their mind usually and some might even call them stubborn since they rarely change their mind on anything."
51,"He is a very adventurous person. He has scaled mountains, kayaked rapids, and skied down mountains. He's also pretty risky, having been injured and almost died multiple times, and is also pretty brash, and not afraid to say what's on his mind.","He is an adventurous guy who has scaled Mt. McKinley, kayaked river rapids and skied mountains successfully. He is also pretty risky and has injured and almost killed himself multiple times, making him a pretty brash individual, who says what's on his mind."
52,"This person is a male that loves to live dangerously by constantly seeking out activities that give hime a rush (like climbing Mt. McKinley). Once he sets his mind to something he follows through until he accomplishes whatever it is he sets out to do. He is also well liked and has a lot of acquaintances. Not only that but he is a very good speaker, able to talk at length about many different topics.","His name was Michael and he was the type of person that always needs a rush (such as climbing Mt. McKinley, back country skiing without avalanche training, mountain biking downhill in the dark, skydiving). He has been injured many times and cheated death. He is also the type of person that has a lot of acquaintances. Because of this he doesn't necessarily spend much time talking to one person. He is also a well-spoken person, able to rattle on and on about various topics."
53,"The person you are going to guess is quite frank and always say exactly what's on his mind. This person is also very adventurous despite of lack in training which resulted in several injuries from his adventures. This person is good in conversations that he makes acquaintances easily. In addition, this person reads a lot, a good speaker and tends to correct wrong grammars made in his presence. Finally this person rarely change his mind. Once he made a decision, he tends to hold unto it for good","The person i was assigned to describe was Michael. Michael wants to say exactly what's on his mind. He is also very adventurous but has no safety training which got him into some injuries. He is quite good in conversation and as a result, makes a lot of friends. In addition, Michael is also a good speaker and is very fond of reading. Finally, Michael rarely changes his decision once he made up his mind."
54,HE IS COMPLETELY HONEST - NEVER SUGAR COATING HIS OPINION. HE IS ADVENTUROUS - EVEN SOMETIMES A BIT DANGEROUSLY ADVENTUROUS. HE MAKES FRIENDS EASILY - MAYBE A BIT TOO EASY. HE ENJOYS READING. HE DOES WHATEVER IT TAKES TO GET WHAT HE WANTS TO DO DONE.,HE IS ADVENTUROUS. HE MAKES FRIENDS EASILY. HE LIKES TO READ. HE IS STRAIGHT FORWARD AND IS A GOGETTER.
55,"He is a bit of a daredevil, defying death and doing crazy things that the normal person wouldn't think about doing. He is a great conversationalist and has a lot of acqaintenances. However, since he knows so many people, he is always rushing through a conversation, not really listening to any one conversation or any one person.","He is a daredevil, a conversationalist who has many acquaintenances but probably not many friends. A bit on the selfish or self-serving side."
56,"He is outgoing and outspoken. He is blunt when he talks to others. He enjoys the outdoors, especially adrenaline pumping activities. He is not always reliable though. He has a zest for life and likes adventures.",They enjoyed doing outdoorsy and adrenaline pumping activities. They have been hurt in the past from doing them. They speak their mind and are at times very blunt. They make plans but do not always keep them. When asked about their opinion on a painting they replied it could use more work.
57,X is superficial and a thrill-seeker. X tends to self promote and doesn't appear to care for others in a real way.,"Michael makes acquaintances easily and makes a lot of social plans that he later changes. He is a thrill seeker and takes unnecessary risks, putting others in danger. He seems pleasant and charming but there is no depth."
58,"Michael seems to be a thrill seeker. he likes to do extreme adventures every chance he gets. He has many acquaintances and is a skilled conversationalist although he has an annoying habit of correcting grammatical errors while chatting. He is very well read and knowledgeable about many topics, his conversations come off and hurried and fake and is prone to make commitments with friends with no intentions on following through with them.",Michael was an adventurer. He has climbed Mount Kingley. He likes to read. He has many acquaintances. He is a skilled conversationalist but he also seems hurried and not engaged while talking. he likes to correct conversation error (grammar) while talking. He is knowledgeable about a lot of different topics.
59,This person may come across as an arrogant braggart. They have many adventurous sounding anecdotes and are willing to correct grammar in casual conversation. They may seem superficial and stubborn.,"He is adventurous and goes on a lot of trips, he is a risk taker and will ski at night with no avalanche training. He has a lot of friends so his interaction can seem too quick and superficial. He will correct your grammar. He will talk about himself at length."
60,He always speaks his mind and is a person who craves adventure. He is good at conversation and has many acquaintances. He is a bit superficial and doesn't always follow up with the plans he makes with people. He likes to read and he can be very stubborn.,"He always speaks his mind. He searches out adventure. He is good at conversation and has many acquaintances, but they tend to be superficial relationships. He reads a lot and he's stubborn."
61,This person like to speak his mind no matter what he is thinking. He is very adventurous and will try anything no matter how dangerous. He likes to talk to people and can make plans with many but not come thru with any. He is a big reader and doesn't think twice about correcting someones grammar while talking.,He spoke whatever was on his mind. He was adventurous even if it was dangerous. He read a lot and thus like to correct other peoples grammar when talking to them. He liked to talk to people.
62,"He tends to considering himself to be the center of all groups. All conversation must revolve around him. He loves adventures and bragging about them to others. He is determined to do whatever he decides to do - for better or for worse - but doesn't seem to have the ability to care about others. While a great conversationalist, he thinks all discussions should be about him.","The target person's name was Michael. He had achieved things like climbing Mt. McKinley, riding a motorbike down a mountain at night, photographing rapids. He seeks adventure. He is a great conversationalist but loves to talk about himself mostly. Very active person with a lot of interests. Seems more interested in himself than others."
63,"He is adventurous and has many outdoor experiences. He reads a lot and corrects grammar. He is confident, a good speaker, and makes plans quickly with the many people he knows. He says what he thinks.","He does a lot of adventurous things outdoors, like skiing without avalanche training. He reads a lot and has good grammar. He corrects other people. He is a good speaker. He makes plans but doesn't always follow through. He knows lots of people. He says what he thinks even if it might be considered a bit rude."
64,This person is very outspoken and honest. He likes to seek adventure. He is very sociable and outgoing. He sticks to his decisions and views once he establishes them.,He was very outspoken and honest. He liked adventure and thrill-seeking activities. He was outgoing and social. He would make plans even if he didn't intend on keeping them. Once he made a decision he stuck to it.
65,"He is very outspoken, persistent, adventurous, and loves to talk.",Sam was outspoken and liked to go on adventures. He was very talkative and would correct others grammar. He made up his mind to do something and nothing could stop him.
66,"He speaks His mind, He like to do hiking and is not worried about dangers, he can speak to a lot of different people easily, when He makes up his mind nothing cant stop Him","His name is Michael, he is ready to express his opinions, he likes risky but fun adventures in the wild, he is a go getter, he can make friends with ease, once he stablish a goal he will work till he gets it"
67,"He likes to speak his mind. He likes adventure and is always seeking new things to do, Whether mountain climbing, kayaking or skiing, he always looks for something exciting to do. He likes to read and he correct peoples grammar. He loves to make friends and enjoys speaking to lots of people. Once he makes his mind up to do something, nothing holds him back.","He loves to adventure and is always looking for a new thrill. Whether mountain climbing, kayaking or down hill skiing, he loves to take risks and do it. He loves people and enjoys having conversations with many people. He loves to read and often correct grammar. when he sets his mind to doing something, he will always follow through."
68,"X seems to be a very hyperactive person. X is very outgoing and outspoken also. X may even have some narcissistic characteristics. X seems to be very risky with their life and well being, often doing things that put them in danger of injury or even death.",X seems to be a hyperactive person. X seems to be a risk taker even to the point of injury or possible death. X seems to be very outgoing and outspoken. X may even have some narcissistic characteristics.
69,"He is very adventurous and fun and is up for anything. He has done a lot of cool activities like skydiving, mountain biking, kayaking, skiing. / / He has a lot of friends because he is so likeable and friendly. He has a great vocabulary and is an extremely good speaker. Once his mind is made up, there is no changing his mind!","John is an adventure-seeker and a risktaker. He went extreme skiing without avalanche training, he went downhill mountain biking at night, he went skydiving, kayaking. / / John has a lot of acquaintances and will make plans that he doesn't always plan to follow through on. / / He has a good vocabulary, and tends to correct other people's grammar, and can be highly critical. / / Once his mind is made up, he won't change it, even to his own detriment."
70,"He is very direct on his statements and does not hold back his opinion. He is an adventurer. He has done some climbing, skydiving, kayak and etc. He is the kind of person who even risks death and gets injured doing it. He is extremely extroverted, easily making friends and acquaintances, but usually it's always something superficial. He is very knowledgeable and kinda of a grammar nazi. He is also a very stubborn person and doesn't matter how hard it is, he will try his best to see it through.","He is adventurer, speaks his mind, got hurt and almost died many times in his adventures. / Very knowledgeable and grammar nazi. Make friends and acquaintances easily, but almost always superficial."
71,"This person is an adventurist. This person likes to go skydiving, and mountain biking. He has be injured many times. He has many acquaintances. He reads a lot and tends to correct people's grammar mistakes. He also has a lot of knowledge and can carry on a conversation about just about anything.",This person likes adventure. He likes to skydive and mountain bike at night. He has been injured may time. He has many acquaintances and is very shallow with relationships. He reads a lot and corrects people's grammatical mistakes. He has a lot of knowledge and can carry on a conversation about just about anything.
72,"When Michael makes plans he follows through, no matter how long it takes. He loves adventure, for instance, mountain climbing with no avalanche training. Michael seems a little reckless. He says what's on his mind, sometimes when he shouldn't and he is willing to make plans with one of his many friends without necessarily following through. He reads a lot and is a good speaker and seems easy to meet and talk to, but is a little critical of others.","His name is MIchael. He like adventure-climbing, sky diving, white water rafting, etc. He is quick to say what's on his mind and can be critical. If he makes plans with someone he might not follow through with them. He reads and speaks well. He also does what he says."
73,"He does not mind being blunt and truthful to people about things they may ask of him. He is very adventurous but is also reckless about things, which has put him in harms way several times. He reads a lot, and can speak well on many topics, but tends to have very superficial friendships with others. He likes to correct the grammar of others, and is very set in his ways when he wants to make a decision, and tends to not change his mind.","Michael was the person I was assigned to describe. Michael when asked by a friend what he thought about a project she was working on, told her that it needed more work. He can be blunt and speak his mind at times. Michael is very adventurous and has already done so many things in his life, such as mountain climbing, kayaking, and skiing. But he is also incredibly reckless about these situations and almost died while skiing. Michael likes to talk and has a very captivating personality and way of speaking, which allows him to have many ""friends"", but the conversations with these people are at the surface-level only. Michael reads a lot and tends to correct the grammar of those around him, if the grammatical error occurs in his presence. Because he reads so much, he is well-versed in several topics, and can talk for a long amount of time on these topics, which makes him very smart and quick-witted. He is very determined when he makes a decision about something, and will complete a task to the very end if he started it."
74,"He speaks what is on his mind,he loves adventure even though sometimes he doesn't have the proper training and has been injured and has faced death,he is very good at speaking and likes to correct grammar errors,has a lot of acquaintances,makes plans even if he intends not to follow through with them,and when he sets his mind to something he never changes it even it he should","Micheal likes adventure,he has been hurt and faced death,Micheal likes to speak his mind like when a girl asked him about her painting he said it needed a little more work,Micheal has a lot of acquainted that is seems as his speech is rushed he makes a lot of plans even thought he does not intend to follow through with them.When Micheal makes up his mind he never changes it even though sometimes he should"
75,"This person is a thrill seeker. He sky dives, mountain climbs, and bungee jumps. He is fast paced in conversation and does not hold plans reliably. He is quite smart and reads a lot. He has been injured a few times and even had a brush or two with death.","This person was a thrill seeker. They mountain climbed, sky dived, and did other 'extreme' activities which brushed them with death and sometimes got them injured. They were a fast talker, yet smart and learned. They also were unreliable when it came to their word."
76,"He's a blunt, thrill seeking, friendly, well-read, determined individual. He says what's on his mind. He loves the outdoors and adventure. He is friendly and has lots of friends. He reads a lot and will correct your grammar. He usually accomplishes what he sets his mind to do.","He is a blunt, adventurous, friendly, determined guy. He says what is on his mind. He loves the outdoors and adventure. He is friendly and has many friends. He usually accomplishes what he sets his mind to do."
77,"He has a lot of friends and is not afraid to speak his mind on things. Once he sets his sights to do something, it gets done no matter what. He is also very adventurous and has done many outdoorsy things.",Sam is adventurous. Sam's conversations may seem quick and artificial. He makes plans with others quick even if he may not follow up on them.
78,He likes to read a lot and is good at making conversation. He makes friends easily and has many aquintances. He is an adventurous person that has done a lot of dangerous things such as skydiving and kayaking.,"He likes adventure and excitement. He has done a lot of activities such a skydiving and kayaking. He has been injured and even close to death. He likes to read. He is good at making conversation, however he can sometimes seem superficial when talking to other people."
79,michael always want to say exactly what's on his mind. he always try to spend his time to search of excitement and fun. michael is skilled conversationalist. he reads alot. he correct grammar mistakes and mistakes.,michael always want to say what's he think.
80,"First of all, Sam knows this person X personally. It seems that Sam likes X. Second, X is frank. He/she always says what in the mind. Third, X likes taking excitement and adventure. For this, he/she has been injured for several times, even risked death. Fourth, X has very good communication skills. He/she knows how to talk to acquaintances easily. Last, X reads a lot and he/she has a strong mind. Once his/her decision is made, it is not easy to change that anymore.","Michael always says what's on his mind. He spends a lot of time in search of excitement and adventure. He has been injured a few times, even with risked death. He is very skilled with communication and he can make acquaintances easily. In addition, he reads a lot. He is a very good speaker and can talk about a lot of topics. Michael changes his mind rarely. This is only when it might do better if he did it."
81,"The target person is a male. He is outgoing, adventurous, and thrill-seeking. He likes to read and corrects people's grammar. Despite that fact, he knows many people and can easily talk to just about anybody but tends to come across as superficial. When he makes up his mind, he's persistent and stubborn.","His name is Micheal, I'm assuming it;s a male. He is outgoing, adventurous, thrill seeking. He likes to read and corrects peoples grammar. Once he makes up his mind, he;s stubborn and persistent. He knows so many people he comes across as superficial when he talks to people because he;s in a rush.."
82,"He is a risk taker and very self assured. He will talk at great lengths on a variety of subjects. X can be brash with others and is very overconfident in his abilities. He feels the need to prove that he is more knowledgeable than those people that he meets. He has accomplished many risky things including mountain biking, mountain climbing, extreme skiing, and he has been injured doing some of these things as he has little regard for others.","He is a risk taker who shows little concern for himself or others. He is well educated and doesn't hesitate to show off to others. He has little concern for the feelings of others. He has gone mountain biking, mountain climbing, and skiing without much concern for harm. He has been injured on occasion while doing these things."
83,"He is a person who always says what's on his mind. A friend once asked hime to commoner on a piece of artwork and he said it needed more work. / He is a risk taker who sky dives, skis without avalanche training, bikes at night, and climbs my mkkinley and kayaks through rapids. / He's personable and makes conversation easily. He is knowledgeable, but often corrects people's grammar. He is also determined. Once he sets his mind to something, he completes it no matter how long or difficult.","He is an adventurous person who takes risks. He has skied without avalanche training, traversed rapids in a kayak, sky dived, climbed mt McKinley. He says what's on his mind. For example, one of his friends asked him to critique a piece of artwork and he told her that it needed more work. / / He corrects people's grammar, and he is a good conversationalist. He know she a lot about a variety of subjects. He isn't determined. Once he starts something he works until it is complete, not matter how long it takes."
